article_num,issue-item__title,issue-item__title href,rlist--inline 2,Abstract,Author1,Author2,Author3,Author4,Author5,Author6
36,When weak sanctioning systems work: Evidence from auto insurance industry fraud investigations,https://doi.org/10.1016/j.obhdp.2019.04.003,30 May 2019,"To deter auto insurance fraud, insurance companies and law enforcement agencies investigate and prosecute suspicious claims. We describe this sanctioning system and perceptions of this system by integrating unique datasets: insurance company records, interviews with insurance fraud investigators, state law enforcement data (CA, NY), and surveys of automotive insurance customers. We identify organizational constraints, such as public relations concerns, that limit the effectiveness of the formal sanctioning system (fewer than 1% of claims that are flagged as suspicious are ever prosecuted for fraud). We also identify psychological factors that deter consumers from committing fraud; consumers over-estimate the probability of detection, over-estimate the consequences of prosecution, are sensitive to social sanctions (e.g., negative publicity), and anticipate high emotional costs, such as shame and embarrassment, that make the prospect of committing fraud highly aversive. That is, psychological factors substantially deter fraud even though the economic sanctions are weak. Our findings integrate scholarship on sanctioning systems (Tenbrunsel & Messick, 1991) and highlight the role of organizational constraints and psychological factors in deterring fraud.","Danielle E. Warren, Maurice E. Schweitzer",,,,,
37,The demotivating effect (and unintended message) of awards,https://doi.org/10.1016/j.obhdp.2019.03.006,29 May 2019,"It is common for organizations to offer awards to motivate individual behavior, yet few empirical studies evaluate their effectiveness in the field. We report a randomized field experiment ( = 15,329) that tests the impact of two common types of symbolic awards: pre-announced awards (prospective) and surprise awards (retrospective). The context is U.S. schools, where we explore how awards motivate student attendance. Contrary to our pre-registered hypotheses and organizational leaders’ expectations, the prospective awards did not on average improve behavior, and the retrospective awards  subsequent attendance. Moreover, we find a significant negative effect on attendance after prospective incentives were removed, which points to a crowding-out effect. Survey experiments probing the mechanisms suggest that awards may cause these unintended effects by inadvertently signaling that the target behavior (perfect attendance) is neither the social norm nor institutionally expected. In addition, receiving the retrospective award suggests to recipients that they have already outperformed the norm and what was expected of them, hence licensing them to miss school. Exploratory analyses shed further light on differential effects of awards by age and performance.","Carly D. Robinson, Jana Gallus, Monica G. Lee, Todd Rogers",,,,,
38,Do status incentives undermine morality-based status attainment? Investigating the mediating role of perceived authenticity,https://doi.org/10.1016/j.obhdp.2019.04.005,17 May 2019,"We propose that status incentives weaken the relationship between moral behaviors and status conferral by undermining perceptions of authenticity. Across two experiments among diverse samples of participants, evidence indicates that observers question the authenticity of moral actors who are pursuing status incentives. Perceptions of authenticity mediate the interaction of moral behaviors and status incentives on status conferral. A third two-wave online survey replicates the experimental findings and reveals that observers’ moral identity further strengthens the interaction of moral behaviors and status incentives in shaping perceptions of authenticity and subsequent status conferral.","Feng Bai, Grace Ching Chi Ho, Wu Liu",,,,,
39,Humility breeds authenticity: How authentic leader humility shapes follower vulnerability and felt authenticity,https://doi.org/10.1016/j.obhdp.2019.04.008,7 May 2019,"Integrating existing work that considers the self through an interpersonal lens with theories pertaining to leader humility and authenticity, we develop a moderated mediation model that theorizes how and under what circumstances leader humility relates to follower felt authenticity. We argue that followers feel less vulnerable when their leaders express humility and further that this relation becomes weaker as the authenticity of leader humility decreases. We also theorize that follower vulnerability is the mechanism explaining the interactive effect of leader humility and its authenticity on follower felt authenticity at work. Our theoretical model was supported across four studies employing both correlational and experimental designs. These results contribute to our understanding of the interpersonal antecedents of authenticity at work as well as the growing body of research on the impact that leader humility has on important employee outcomes.","Burak Oc, Michael A. Daniels, James M. Diefendorff, Michael R. Bashshur, Gary J. Greguras",,,,,
40,"Simplification and defaults affect adoption and impact of technology, but decision makers do not realize it",https://doi.org/10.1016/j.obhdp.2019.04.001,22 April 2019,"A field experiment (N = 6976) examines how enrollment defaults affect adoption and impact of an education technology that sends weekly automated alerts on students’ academic progress to parents. We show that a standard (high-friction) opt-in process induces extremely low parent take-up (<1%), while a simplified process yields higher enrollment (11%). Yet, with such low take-up, both fail to improve average student achievement. Meanwhile, automatically enrolling parents increases take-up to 95% and improves student achievement as measured by GPA and course passing. The GPA of students whose parents were automatically enrolled increased by an average of 0.06 points, and one in four students did not fail a class they would have otherwise failed. Surveys show automatic enrollment is uncommon, and its impact is underestimated: District leaders  take-up under standard opt-in processes by about 40 percentage points and  take-up under automatic enrollment by 29 percentage points. After learning the actual take-up rates, district leaders report being willing to pay substantially more for the technology when implemented under automatic enrollment than by standard opt-in processes.","Peter Bergman, Jessica Lasky-Fink, Todd Rogers",,,,,
